12:58:30.404859 IP 140.82.112.25.443 > 10.0.0.126.62188: Flags [P.], seq 1278684104:1278684145, ack 1042670861, win 73, options [nop,nop,TS val 996634496 ecr 2099292068], length 41
12:58:30.404947 IP 10.0.0.126.62188 > 140.82.112.25.443: Flags [.], ack 41, win 2048, options [nop,nop,TS val 2099351819 ecr 996634496], length 0
12:58:30.405001 IP 10.0.0.126.62188 > 140.82.112.25.443: Flags [P.], seq 1:46, ack 41, win 2048, options [nop,nop,TS val 2099351819 ecr 996634496], length 45
12:58:30.505873 IP 140.82.112.25.443 > 10.0.0.126.62188: Flags [.], ack 46, win 73, options [nop,nop,TS val 996634598 ecr 2099351819], length 0
12:58:30.505880 IP 140.82.112.25.443 > 10.0.0.126.62188: Flags [.], ack 46, win 73, options [nop,nop,TS val 996634598 ecr 2099351819], length 0
12:58:30.505882 IP 140.82.112.25.443 > 10.0.0.126.62188: Flags [P.], seq 41:65, ack 46, win 73, options [nop,nop,TS val 996634599 ecr 2099351819], length 24
12:58:30.505946 IP 10.0.0.126.62188 > 140.82.112.25.443: Flags [.], ack 65, win 2048, options [nop,nop,TS val 2099351919 ecr 996634599], length 0
12:58:30.505988 IP 10.0.0.126.62188 > 140.82.112.25.443: Flags [F.], seq 46, ack 65, win 2048, options [nop,nop,TS val 2099351919 ecr 996634599], length 0
12:58:30.595294 IP6 fe80::fa97:c6d1:ff3b:f39c > ff02::1:ff3b:f39c: HBH ICMP6, multicast listener reportmax resp delay: 0 addr: ff02::1:ff3b:f39c, length 24
12:58:30.595341 IP6 fe80::fa97:c6d1:ff3b:f39c > ff02::1:ff3b:f39c: HBH ICMP6, multicast listener reportmax resp delay: 0 addr: ff02::1:ff3b:f39c, length 24
12:58:30.606530 IP 140.82.112.25.443 > 10.0.0.126.62188: Flags [F.], seq 65, ack 46, win 73, options [nop,nop,TS val 996634599 ecr 2099351819], length 0
12:58:30.606538 IP 140.82.112.25.443 > 10.0.0.126.62188: Flags [.], ack 47, win 73, options [nop,nop,TS val 996634699 ecr 2099351919], length 0
12:58:30.606563 IP 10.0.0.126.62188 > 140.82.112.25.443: Flags [F.], seq 46, ack 66, win 2048, options [nop,nop,TS val 2099352019 ecr 996634599], length 0
12:58:30.638894 IP 10.0.0.126.62158 > 104.18.27.211.443: Flags [P.], seq 2147089743:2147089798, ack 3660722352, win 4096, length 55
12:58:30.638920 IP 10.0.0.126.62158 > 104.18.27.211.443: Flags [P.], seq 55:94, ack 1, win 4096, length 39
12:58:30.638931 IP 10.0.0.126.62158 > 104.18.27.211.443: Flags [P.], seq 94:253, ack 1, win 4096, length 159
12:58:30.653226 IP 104.18.27.211.443 > 10.0.0.126.62158: Flags [.], ack 94, win 209, length 0
12:58:30.653239 IP 104.18.27.211.443 > 10.0.0.126.62158: Flags [P.], seq 1:40, ack 253, win 210, length 39
12:58:30.653241 IP 104.18.27.211.443 > 10.0.0.126.62158: Flags [P.], seq 40:824, ack 253, win 210, length 784
12:58:30.653244 IP 104.18.27.211.443 > 10.0.0.126.62158: Flags [P.], seq 824:855, ack 253, win 210, length 31
12:58:30.653309 IP 10.0.0.126.62158 > 104.18.27.211.443: Flags [.], ack 40, win 4095, length 0
12:58:30.653318 IP 10.0.0.126.62158 > 104.18.27.211.443: Flags [.], ack 824, win 4083, length 0
12:58:30.653321 IP 10.0.0.126.62158 > 104.18.27.211.443: Flags [.], ack 855, win 4082, length 0
12:58:30.653894 IP 10.0.0.126.62529 > 140.82.112.25.443: Flags [S], seq 1415965827, win 65535, options [mss 1460,nop,wscale 6,nop,nop,TS val 3542761715 ecr 0,sackOK,eol], length 0
12:58:30.702023 IP 10.0.0.126.50374 > 239.255.255.250.1900: UDP, length 174
12:58:30.702038 IP 10.0.0.126.64770 > 239.255.255.250.1900: UDP, length 170
12:58:30.702057 IP 10.0.0.126.50374 > 239.255.255.250.1900: UDP, length 174
12:58:30.702059 IP 10.0.0.126.64770 > 239.255.255.250.1900: UDP, length 170
12:58:30.702105 IP 10.9.3.253.63084 > 239.255.255.250.1900: UDP, length 170
12:58:30.702108 IP 10.0.0.126.50374 > 239.255.255.250.1900: UDP, length 174
12:58:30.702109 IP 10.9.3.253.50716 > 239.255.255.250.1900: UDP, length 174
12:58:30.702112 IP 10.0.0.126.64770 > 239.255.255.250.1900: UDP, length 170
12:58:30.736153 IP 10.0.0.126.62160 > 18.169.55.40.443: Flags [P.], seq 2509674393:2509674448, ack 3912162378, win 2048, options [nop,nop,TS val 2583060667 ecr 3078031168], length 55
12:58:30.763550 IP 140.82.112.25.443 > 10.0.0.126.62529: Flags [S.], seq 3598968076, ack 1415965828, win 65535, options [mss 1436,sackOK,TS val 750609322 ecr 3542761715,nop,wscale 10], length 0
12:58:30.763584 IP 10.0.0.126.62529 > 140.82.112.25.443: Flags [.], ack 1, win 2069, options [nop,nop,TS val 3542761824 ecr 750609322], length 0
12:58:30.763816 IP 10.0.0.126.62529 > 140.82.112.25.443: Flags [P.], seq 1:518, ack 1, win 2069, options [nop,nop,TS val 3542761824 ecr 750609322], length 517
12:58:30.774036 IP 18.169.55.40.443 > 10.0.0.126.62160: Flags [P.], seq 1:58, ack 55, win 8, options [nop,nop,TS val 3078041475 ecr 2583060667], length 57
12:58:30.774097 IP 10.0.0.126.62160 > 18.169.55.40.443: Flags [.], ack 58, win 2047, options [nop,nop,TS val 2583060704 ecr 3078041475], length 0
12:58:30.874603 IP 140.82.112.25.443 > 10.0.0.126.62529: Flags [.], seq 1:1425, ack 518, win 66, options [nop,nop,TS val 750609434 ecr 3542761824], length 1424
12:58:30.874617 IP 140.82.112.25.443 > 10.0.0.126.62529: Flags [P.], seq 1425:2710, ack 518, win 66, options [nop,nop,TS val 750609434 ecr 3542761824], length 1285
12:58:30.874670 IP 10.0.0.126.62529 > 140.82.112.25.443: Flags [.], ack 1425, win 2047, options [nop,nop,TS val 3542761934 ecr 750609434], length 0
12:58:30.874700 IP 10.0.0.126.62529 > 140.82.112.25.443: Flags [.], ack 2710, win 2026, options [nop,nop,TS val 3542761934 ecr 750609434], length 0
12:58:30.875233 IP 10.0.0.126.62529 > 140.82.112.25.443: Flags [P.], seq 518:582, ack 2710, win 2048, options [nop,nop,TS val 3542761934 ecr 750609434], length 64
12:58:30.875440 IP 10.0.0.126.62529 > 140.82.112.25.443: Flags [P.], seq 582:1763, ack 2710, win 2048, options [nop,nop,TS val 3542761934 ecr 750609434], length 1181
12:58:30.984532 IP 140.82.112.25.443 > 10.0.0.126.62529: Flags [P.], seq 2710:2789, ack 582, win 66, options [nop,nop,TS val 750609544 ecr 3542761934], length 79
12:58:30.984539 IP 140.82.112.25.443 > 10.0.0.126.62529: Flags [P.], seq 2789:2868, ack 582, win 66, options [nop,nop,TS val 750609544 ecr 3542761934], length 79
12:58:30.984567 IP 10.0.0.126.62529 > 140.82.112.25.443: Flags [.], ack 2789, win 2046, options [nop,nop,TS val 3542762043 ecr 750609544], length 0
12:58:30.984579 IP 10.0.0.126.62529 > 140.82.112.25.443: Flags [.], ack 2868, win 2045, options [nop,nop,TS val 3542762043 ecr 750609544], length 0
12:58:30.990376 IP 140.82.112.25.443 > 10.0.0.126.62529: Flags [P.], seq 2868:3406, ack 1763, win 68, options [nop,nop,TS val 750609547 ecr 3542761934], length 538
12:58:30.990416 IP 10.0.0.126.62529 > 140.82.112.25.443: Flags [.], ack 3406, win 2039, options [nop,nop,TS val 3542762048 ecr 750609547], length 0
12:58:30.994034 IP 10.0.0.126.62529 > 140.82.112.25.443: Flags [.], seq 1763:3187, ack 3406, win 2048, options [nop,nop,TS val 3542762051 ecr 750609547], length 1424
12:58:30.994038 IP 10.0.0.126.62529 > 140.82.112.25.443: Flags [P.], seq 3187:3772, ack 3406, win 2048, options [nop,nop,TS val 3542762051 ecr 750609547], length 585
12:58:31.031571 IP 54.144.56.0.443 > 10.0.0.126.62246: Flags [P.], seq 1130610594:1130610625, ack 2981137288, win 141, options [nop,nop,TS val 338685800 ecr 616711400], length 31
12:58:31.031605 IP 10.0.0.126.62246 > 54.144.56.0.443: Flags [.], ack 31, win 2047, options [nop,nop,TS val 616736286 ecr 338685800], length 0
12:58:31.031694 IP 10.0.0.126.62246 > 54.144.56.0.443: Flags [P.], seq 1:36, ack 31, win 2048, options [nop,nop,TS val 616736286 ecr 338685800], length 35
12:58:31.103191 IP 140.82.112.25.443 > 10.0.0.126.62529: Flags [.], ack 3772, win 72, options [nop,nop,TS val 750609662 ecr 3542762051], length 0
12:58:31.103198 IP 140.82.112.25.443 > 10.0.0.126.62529: Flags [P.], seq 3406:3479, ack 3772, win 72, options [nop,nop,TS val 750609663 ecr 3542762051], length 73
12:58:31.103227 IP 10.0.0.126.62529 > 140.82.112.25.443: Flags [.], ack 3479, win 2046, options [nop,nop,TS val 3542762159 ecr 750609663], length 0
12:58:31.118419 IP 54.144.56.0.443 > 10.0.0.126.62250: Flags [P.], seq 721509678:721509709, ack 1787361759, win 151, options [nop,nop,TS val 338685887 ecr 2369621630], length 31
12:58:31.118454 IP 10.0.0.126.62250 > 54.144.56.0.443: Flags [.], ack 31, win 2047, options [nop,nop,TS val 2369646519 ecr 338685887], length 0
12:58:31.118544 IP 10.0.0.126.62250 > 54.144.56.0.443: Flags [P.], seq 1:36, ack 31, win 2048, options [nop,nop,TS val 2369646519 ecr 338685887], length 35
12:58:31.131985 IP 54.144.56.0.443 > 10.0.0.126.62246: Flags [.], ack 36, win 141, options [nop,nop,TS val 338685901 ecr 616736286], length 0
12:58:31.131998 IP 54.144.56.0.443 > 10.0.0.126.62246: Flags [.], ack 36, win 141, options [nop,nop,TS val 338685901 ecr 616736286], length 0
12:58:31.219693 IP 54.144.56.0.443 > 10.0.0.126.62250: Flags [.], ack 36, win 151, options [nop,nop,TS val 338685988 ecr 2369646519], length 0
12:58:31.219700 IP 54.144.56.0.443 > 10.0.0.126.62250: Flags [.], ack 36, win 151, options [nop,nop,TS val 338685988 ecr 2369646519], length 0

